,texto,tokens
377,los esperamos en plaza universidad para que vean los productos que los artesanos ofrecenestarán hasta el sábado de 900 a 2000 horaslos esperamos sigdlsigueme,"['los', 'esperamos', 'en', 'plaza', 'universidad', 'para', 'que', 'vean', 'los', 'productos', 'que', 'los', 'artesanos', 'ofrecenestarán', 'hasta', 'el', 'sábado', 'de', '900', 'a', '2000', 'horaslos', 'esperamos', 'sigdlsigueme']"
380,el día de hoy entregamos las obras de remodelación de nuestro querido mercado libertador miguel hidalgo mejor conocido como de la copadespués de un gran trabajo hemos logrado transformar este espacio en un lugar moderno funcional y acogedor para todos nuestros visitantesse trata del quinto mercado que se inaugura a través del programa mi mercadoestas son algunas de las mejoras que realizamos rehabilitación de instalaciones eléctricas hidráulicas y sanitarias pintura fresca en todos los rincones impermeabilización de la cubierta de losa de concreto rehabilitación de baños para mayor comodidad aplanados de muros en mal estado rehabilitación de losa de concreto en los pasillos sustitución de cortinas de acero en los accesos al mercado rehabilitación de la plazoleta del exterior mercado,"['el', 'día', 'de', 'hoy', 'entregamos', 'las', 'obras', 'de', 'remodelación', 'de', 'nuestro', 'querido', 'mercado', 'libertador', 'miguel', 'hidalgo', 'mejor', 'conocido', 'como', 'de', 'la', 'copadespués', 'de', 'un', 'gran', 'trabajo', 'hemos', 'logrado', 'transformar', 'este', 'espacio', 'en', 'un', 'lugar', 'moderno', 'funcional', 'y', 'acogedor', 'para', 'todos', 'nuestros', 'visitantesse', 'trata', 'del', 'quinto', 'mercado', 'que', 'se', 'inaugura', 'a', 'través', 'del', 'programa', 'mi', 'mercadoestas', 'son', 'algunas', 'de', 'las', 'mejoras', 'que', 'realizamos', 'rehabilitación', 'de', 'instalaciones', 'eléctricas', 'hidráulicas', 'y', 'sanitarias', 'pintura', 'fresca', 'en', 'todos', 'los', 'rincones', 'impermeabilización', 'de', 'la', 'cubierta', 'de', 'losa', 'de', 'concreto', 'rehabilitación', 'de', 'baños', 'para', 'mayor', 'comodidad', 'aplanados', 'de', 'muros', 'en', 'mal', 'estado', 'rehabilitación', 'de', 'losa', 'de', 'concreto', 'en', 'los', 'pasillos', 'sustitución', 'de', 'cortinas', 'de', 'acero', 'en', 'los', 'accesos', 'al', 'mercado', 'rehabilitación', 'de', 'la', 'plazoleta', 'del', 'exterior', 'mercado']"
383,un nuevo capítulo para nuestros mercados en esta administración siempre hemos creído en el potencial de nuestros mercados como motores de desarrollo económico y espacios de convivencia por eso nos llena de satisfacción entregar este mercado renovado en el marco del 50 aniversario de la fundación de la colonia miguel hidalgoeste es el quinto mercado municipal que se entrega oficialmente a través del programa mi mercado y no vamos a parar aquí seguimos trabajando en mejorar otros edificios de este tipoademás en este proceso hemos implementado acciones para apoyar a nuestros locatarios impartimos cursos en administración y finanzas para mejorar sus ventas ofrecimos financiamiento entregaremos una bicicleta y realizamos el reparto de mandiles y bolsasestamos comprometidos con el crecimiento de nuestros mercados y con el bienestar de nuestros comerciantes ánimo guadalajara vamos por más mercados,"['un', 'nuevo', 'capítulo', 'para', 'nuestros', 'mercados', 'en', 'esta', 'administración', 'siempre', 'hemos', 'creído', 'en', 'el', 'potencial', 'de', 'nuestros', 'mercados', 'como', 'motores', 'de', 'desarrollo', 'económico', 'y', 'espacios', 'de', 'convivencia', 'por', 'eso', 'nos', 'llena', 'de', 'satisfacción', 'entregar', 'este', 'mercado', 'renovado', 'en', 'el', 'marco', 'del', '50', 'aniversario', 'de', 'la', 'fundación', 'de', 'la', 'colonia', 'miguel', 'hidalgoeste', 'es', 'el', 'quinto', 'mercado', 'municipal', 'que', 'se', 'entrega', 'oficialmente', 'a', 'través', 'del', 'programa', 'mi', 'mercado', 'y', 'no', 'vamos', 'a', 'parar', 'aquí', 'seguimos', 'trabajando', 'en', 'mejorar', 'otros', 'edificios', 'de', 'este', 'tipoademás', 'en', 'este', 'proceso', 'hemos', 'implementado', 'acciones', 'para', 'apoyar', 'a', 'nuestros', 'locatarios', 'impartimos', 'cursos', 'en', 'administración', 'y', 'finanzas', 'para', 'mejorar', 'sus', 'ventas', 'ofrecimos', 'financiamiento', 'entregaremos', 'una', 'bicicleta', 'y', 'realizamos', 'el', 'reparto', 'de', 'mandiles', 'y', 'bolsasestamos', 'comprometidos', 'con', 'el', 'crecimiento', 'de', 'nuestros', 'mercados', 'y', 'con', 'el', 'bienestar', 'de', 'nuestros', 'comerciantes', 'ánimo', 'guadalajara', 'vamos', 'por', 'más', 'mercados']"
386,las se notan ahora las niñas niños y adolescentes de nuestra casa hogar villas miravalle gozan de espacios dignos y de calidad para el pleno desarrollo de su vida diaria y actividades a través de este hermoso proyecto durante esta administración hemos trabajado arduamente y nos hemos comprometido para que nuestras infancias que en algún momento estuvieron en alguna situación de vulnerabilidad estén rodeadas de un entorno seguro y feliz buenasacciones,"['las', 'se', 'notan', 'ahora', 'las', 'niñas', 'niños', 'y', 'adolescentes', 'de', 'nuestra', 'casa', 'hogar', 'villas', 'miravalle', 'gozan', 'de', 'espacios', 'dignos', 'y', 'de', 'calidad', 'para', 'el', 'pleno', 'desarrollo', 'de', 'su', 'vida', 'diaria', 'y', 'actividades', 'a', 'través', 'de', 'este', 'hermoso', 'proyecto', 'durante', 'esta', 'administración', 'hemos', 'trabajado', 'arduamente', 'y', 'nos', 'hemos', 'comprometido', 'para', 'que', 'nuestras', 'infancias', 'que', 'en', 'algún', 'momento', 'estuvieron', 'en', 'alguna', 'situación', 'de', 'vulnerabilidad', 'estén', 'rodeadas', 'de', 'un', 'entorno', 'seguro', 'y', 'feliz', 'buenasacciones']"
389,todo un éxito que reunió a más de 200 emprendedores del estado y tuvo la visita de más de 5 mil asistentes se siente muy chido cómo este tipo de eventos respalda y potencia el talento las ideas y negocios de las juventudes aquí les compartimos algunas imágenes de lo que vivimos los tres días de exposigan pendientes de nuestras redes sociales porque se viene más de guanatos emprende emprendejovendelaperla,"['todo', 'un', 'éxito', 'que', 'reunió', 'a', 'más', 'de', '200', 'emprendedores', 'del', 'estado', 'y', 'tuvo', 'la', 'visita', 'de', 'más', 'de', '5', 'mil', 'asistentes', 'se', 'siente', 'muy', 'chido', 'cómo', 'este', 'tipo', 'de', 'eventos', 'respalda', 'y', 'potencia', 'el', 'talento', 'las', 'ideas', 'y', 'negocios', 'de', 'las', 'juventudes', 'aquí', 'les', 'compartimos', 'algunas', 'imágenes', 'de', 'lo', 'que', 'vivimos', 'los', 'tres', 'días', 'de', 'exposigan', 'pendientes', 'de', 'nuestras', 'redes', 'sociales', 'porque', 'se', 'viene', 'más', 'de', 'guanatos', 'emprende', 'emprendejovendelaperla']"
392,el emplazamiento de este sitio es ese lugar en el cual se crece fundó y nació oficialmente la ciudad de guadalajara quéhacerenelcentro,"['el', 'emplazamiento', 'de', 'este', 'sitio', 'es', 'ese', 'lugar', 'en', 'el', 'cual', 'se', 'crece', 'fundó', 'y', 'nació', 'oficialmente', 'la', 'ciudad', 'de', 'guadalajara', 'quéhacerenelcentro']"
395,con gran emoción y orgullo hoy se llevó a cabo la graduación de la primera generación del programa talentos guadalajara el cual se les brindó a 100 familiares de personas desaparecidas herramientas para emprender en sus propios negociosfelicitamos a las y los graduados quienes en cada sesión mostraron su compromiso y estuvieron siempre dispuestos a mejorar sus conocimientos aprendiendo sobre innovación mercadotecnia ventas y finanzas las beneficiadas y beneficiados del programa también obtuvieron el cheque de apoyos familiares directos de personas desaparecidas 2023 seguimos trabajando día a día en solidaridad y proximidad con las tapatías y tapatíos quienes viven la ausencia de algún familiar desaparecido logrando generar entre todos una gran red de apoyo accionesquenosunen,"['con', 'gran', 'emoción', 'y', 'orgullo', 'hoy', 'se', 'llevó', 'a', 'cabo', 'la', 'graduación', 'de', 'la', 'primera', 'generación', 'del', 'programa', 'talentos', 'guadalajara', 'el', 'cual', 'se', 'les', 'brindó', 'a', '100', 'familiares', 'de', 'personas', 'desaparecidas', 'herramientas', 'para', 'emprender', 'en', 'sus', 'propios', 'negociosfelicitamos', 'a', 'las', 'y', 'los', 'graduados', 'quienes', 'en', 'cada', 'sesión', 'mostraron', 'su', 'compromiso', 'y', 'estuvieron', 'siempre', 'dispuestos', 'a', 'mejorar', 'sus', 'conocimientos', 'aprendiendo', 'sobre', 'innovación', 'mercadotecnia', 'ventas', 'y', 'finanzas', 'las', 'beneficiadas', 'y', 'beneficiados', 'del', 'programa', 'también', 'obtuvieron', 'el', 'cheque', 'de', 'apoyos', 'familiares', 'directos', 'de', 'personas', 'desaparecidas', '2023', 'seguimos', 'trabajando', 'día', 'a', 'día', 'en', 'solidaridad', 'y', 'proximidad', 'con', 'las', 'tapatías', 'y', 'tapatíos', 'quienes', 'viven', 'la', 'ausencia', 'de', 'algún', 'familiar', 'desaparecido', 'logrando', 'generar', 'entre', 'todos', 'una', 'gran', 'red', 'de', 'apoyo', 'accionesquenosunen']"
398,bienvenidos a una experiencia única te invitamos a sumergirte en el mundo de sueñas la mar y una rosa encendidaven a descubrir la fascinante exhibición del renombrado artista plástico gil garea que estará disponible hasta el 29 de octubre de 2023 en el museo raúl anguiano mura gil garea un artista de primera categoría nos dejó en 2022 y esta es tu oportunidad de apreciar sus últimas creaciones no te la pierdas y eso no es todo estamos emocionados de anunciar que muy pronto presentaremos un libro que lleva el mismo nombre que esta magnífica exposición mantente atento para más detallesven y déjate inspirar por el arte de gil garea gilgarea,"['bienvenidos', 'a', 'una', 'experiencia', 'única', 'te', 'invitamos', 'a', 'sumergirte', 'en', 'el', 'mundo', 'de', 'sueñas', 'la', 'mar', 'y', 'una', 'rosa', 'encendidaven', 'a', 'descubrir', 'la', 'fascinante', 'exhibición', 'del', 'renombrado', 'artista', 'plástico', 'gil', 'garea', 'que', 'estará', 'disponible', 'hasta', 'el', '29', 'de', 'octubre', 'de', '2023', 'en', 'el', 'museo', 'raúl', 'anguiano', 'mura', 'gil', 'garea', 'un', 'artista', 'de', 'primera', 'categoría', 'nos', 'dejó', 'en', '2022', 'y', 'esta', 'es', 'tu', 'oportunidad', 'de', 'apreciar', 'sus', 'últimas', 'creaciones', 'no', 'te', 'la', 'pierdas', 'y', 'eso', 'no', 'es', 'todo', 'estamos', 'emocionados', 'de', 'anunciar', 'que', 'muy', 'pronto', 'presentaremos', 'un', 'libro', 'que', 'lleva', 'el', 'mismo', 'nombre', 'que', 'esta', 'magnífica', 'exposición', 'mantente', 'atento', 'para', 'más', 'detallesven', 'y', 'déjate', 'inspirar', 'por', 'el', 'arte', 'de', 'gil', 'garea', 'gilgarea']"
401,demotáctica global presenta los resultados de nuestra segunda encuesta rumbo a las elecciones para gobernador del estado de carlos lomelí pablo lemus y alfonso petersen lideran las encuestas de sus respectivos partidos jalisco,"['demotáctica', 'global', 'presenta', 'los', 'resultados', 'de', 'nuestra', 'segunda', 'encuesta', 'rumbo', 'a', 'las', 'elecciones', 'para', 'gobernador', 'del', 'estado', 'de', 'carlos', 'lomelí', 'pablo', 'lemus', 'y', 'alfonso', 'petersen', 'lideran', 'las', 'encuestas', 'de', 'sus', 'respectivos', 'partidos', 'jalisco']"
404,la perseverancia es el claro ejemplo de volver a guadalajara y coronarse como la campeona absoluta wta,"['la', 'perseverancia', 'es', 'el', 'claro', 'ejemplo', 'de', 'volver', 'a', 'guadalajara', 'y', 'coronarse', 'como', 'la', 'campeona', 'absoluta', 'wta']"
407,hoy se formaliza a través de la firma de convenio entre el y la utilización de la plataforma digital para la publicidad y divulgación de la información en y georreferenciada de las obras públicas de ante el complejo desafío que tenemos de contar con el derecho a un ambiente libre de corrupción es necesario introducir una nueva lógica de hacer las cosas a través de acciones que modifiquen prácticas institucionales con la firma de este convenio con se formaliza este logro ahora cuenta con 372 proyectos de publicados para ser consultados en conócela cmicjalisco,"['hoy', 'se', 'formaliza', 'a', 'través', 'de', 'la', 'firma', 'de', 'convenio', 'entre', 'el', 'y', 'la', 'utilización', 'de', 'la', 'plataforma', 'digital', 'para', 'la', 'publicidad', 'y', 'divulgación', 'de', 'la', 'información', 'en', 'y', 'georreferenciada', 'de', 'las', 'obras', 'públicas', 'de', 'ante', 'el', 'complejo', 'desafío', 'que', 'tenemos', 'de', 'contar', 'con', 'el', 'derecho', 'a', 'un', 'ambiente', 'libre', 'de', 'corrupción', 'es', 'necesario', 'introducir', 'una', 'nueva', 'lógica', 'de', 'hacer', 'las', 'cosas', 'a', 'través', 'de', 'acciones', 'que', 'modifiquen', 'prácticas', 'institucionales', 'con', 'la', 'firma', 'de', 'este', 'convenio', 'con', 'se', 'formaliza', 'este', 'logro', 'ahora', 'cuenta', 'con', '372', 'proyectos', 'de', 'publicados', 'para', 'ser', 'consultados', 'en', 'conócela', 'cmicjalisco']"
410,raicilla ancestral disponible en botella de 750 ml blanca y reposada en barricas de roble blanco raicilla,"['raicilla', 'ancestral', 'disponible', 'en', 'botella', 'de', '750', 'ml', 'blanca', 'y', 'reposada', 'en', 'barricas', 'de', 'roble', 'blanco', 'raicilla']"
419,y entérate cómo desarticulamos una presunta banda de roba tráileres luego de que en coordinación con la fiscalía del estado de jalisco detuvimos a cinco hombres y un menor aseguramos una bodega y recuperamos dos contenedores y mercancía valuada en alrededor de 4 millones de pesos en el álamo industrial daclick,"['y', 'entérate', 'cómo', 'desarticulamos', 'una', 'presunta', 'banda', 'de', 'roba', 'tráileres', 'luego', 'de', 'que', 'en', 'coordinación', 'con', 'la', 'fiscalía', 'del', 'estado', 'de', 'jalisco', 'detuvimos', 'a', 'cinco', 'hombres', 'y', 'un', 'menor', 'aseguramos', 'una', 'bodega', 'y', 'recuperamos', 'dos', 'contenedores', 'y', 'mercancía', 'valuada', 'en', 'alrededor', 'de', '4', 'millones', 'de', 'pesos', 'en', 'el', 'álamo', 'industrial', 'daclick']"
425,con el gusto de recibirlos el día de hoy amigo artista y su sra esposa impulsar la cultura y el arte sin pilares en el nuestra ciudad es semillero de grandes talentos mujeres y hombres que ponen en alto nuestra ciudad guadalajara,"['con', 'el', 'gusto', 'de', 'recibirlos', 'el', 'día', 'de', 'hoy', 'amigo', 'artista', 'y', 'su', 'sra', 'esposa', 'impulsar', 'la', 'cultura', 'y', 'el', 'arte', 'sin', 'pilares', 'en', 'el', 'nuestra', 'ciudad', 'es', 'semillero', 'de', 'grandes', 'talentos', 'mujeres', 'y', 'hombres', 'que', 'ponen', 'en', 'alto', 'nuestra', 'ciudad', 'guadalajara']"
428,invitación de mi compadre leyendaslegendarias,"['invitación', 'de', 'mi', 'compadre', 'leyendaslegendarias']"
431,hospicio cabañas un sueño hecho realidad gdl,"['hospicio', 'cabañas', 'un', 'sueño', 'hecho', 'realidad', 'gdl']"
437,hoy tienen que visitar las dos expos que tenemos en el de guadalajara y apoyar a los emprendedoressobre paseo fray antonio alcalde frente a la plaza de armas se encuentra el festival cinco sentidos organizado por nuestro grupo de empresarios jóvenes del centro histórico de guadalajaraademás en la plaza de la liberación podrán encontrar la expo emprende joven los esperamos centrohistórico,"['hoy', 'tienen', 'que', 'visitar', 'las', 'dos', 'expos', 'que', 'tenemos', 'en', 'el', 'de', 'guadalajara', 'y', 'apoyar', 'a', 'los', 'emprendedoressobre', 'paseo', 'fray', 'antonio', 'alcalde', 'frente', 'a', 'la', 'plaza', 'de', 'armas', 'se', 'encuentra', 'el', 'festival', 'cinco', 'sentidos', 'organizado', 'por', 'nuestro', 'grupo', 'de', 'empresarios', 'jóvenes', 'del', 'centro', 'histórico', 'de', 'guadalajaraademás', 'en', 'la', 'plaza', 'de', 'la', 'liberación', 'podrán', 'encontrar', 'la', 'expo', 'emprende', 'joven', 'los', 'esperamos', 'centrohistórico']"
440,qué increíble torneo quién iba a decir que aquel 150 del 2019 del que tantas personas nos señalaban que fracasaría hoy se convertiría en este torneo tan importante y de talla internacional que además se vive en nuestra ciudad cada año mejor felicidades ahora muero de ganas de regresar a jugar zapopan,"['qué', 'increíble', 'torneo', 'quién', 'iba', 'a', 'decir', 'que', 'aquel', '150', 'del', '2019', 'del', 'que', 'tantas', 'personas', 'nos', 'señalaban', 'que', 'fracasaría', 'hoy', 'se', 'convertiría', 'en', 'este', 'torneo', 'tan', 'importante', 'y', 'de', 'talla', 'internacional', 'que', 'además', 'se', 'vive', 'en', 'nuestra', 'ciudad', 'cada', 'año', 'mejor', 'felicidades', 'ahora', 'muero', 'de', 'ganas', 'de', 'regresar', 'a', 'jugar', 'zapopan']"
443,dedicado a todas mis familias y parientes antepasados y actuales que dios siempre nos mantenga en su gloria puertovallarta,"['dedicado', 'a', 'todas', 'mis', 'familias', 'y', 'parientes', 'antepasados', 'y', 'actuales', 'que', 'dios', 'siempre', 'nos', 'mantenga', 'en', 'su', 'gloria', 'puertovallarta']"
446,ayer celebramos está gran campaña de vacunación de vph con nuestros grandes amigos de muchas gracias por la gran labor que hacen y por todo su compromiso con la sociedad de jalisco sigamos fomentando el autocuidado en jalisco porlasaluddetodxs,"['ayer', 'celebramos', 'está', 'gran', 'campaña', 'de', 'vacunación', 'de', 'vph', 'con', 'nuestros', 'grandes', 'amigos', 'de', 'muchas', 'gracias', 'por', 'la', 'gran', 'labor', 'que', 'hacen', 'y', 'por', 'todo', 'su', 'compromiso', 'con', 'la', 'sociedad', 'de', 'jalisco', 'sigamos', 'fomentando', 'el', 'autocuidado', 'en', 'jalisco', 'porlasaluddetodxs']"
452,así iniciamos el primer día de con 200 emprendedores bandas tapatías y más de 2 mil visitantes eealeenos vemos hoy emprendejovendelaperla,"['así', 'iniciamos', 'el', 'primer', 'día', 'de', 'con', '200', 'emprendedores', 'bandas', 'tapatías', 'y', 'más', 'de', '2', 'mil', 'visitantes', 'eealeenos', 'vemos', 'hoy', 'emprendejovendelaperla']"
455,ya los estamos esperando en la expo emprende joven en la perla que se realiza en la plaza liberación del de guadalajara estará abierta este sábado hasta las 1900 horasparticipan jóvenes emprendedores de 18 a 35 años de 60 municipios de jalisco son 220 stands donde ofrecen productos de belleza dulces típicos manualidades ropa calzado artesanías joyería y muchas cosas más centrohistórico,"['ya', 'los', 'estamos', 'esperando', 'en', 'la', 'expo', 'emprende', 'joven', 'en', 'la', 'perla', 'que', 'se', 'realiza', 'en', 'la', 'plaza', 'liberación', 'del', 'de', 'guadalajara', 'estará', 'abierta', 'este', 'sábado', 'hasta', 'las', '1900', 'horasparticipan', 'jóvenes', 'emprendedores', 'de', '18', 'a', '35', 'años', 'de', '60', 'municipios', 'de', 'jalisco', 'son', '220', 'stands', 'donde', 'ofrecen', 'productos', 'de', 'belleza', 'dulces', 'típicos', 'manualidades', 'ropa', 'calzado', 'artesanías', 'joyería', 'y', 'muchas', 'cosas', 'más', 'centrohistórico']"
461,arrancamos con la presencia de cerca de 3 mil visitantes muchas gracias por darse una vuelta y conocer a los más de 200 emprendedores de la capital y el estado que vinieron a ofertar sus productos recuerden que estaremos hasta el domingo 24 habrá muchos eventos conferencias conciertos y emprendimiento sigamos consumiendo local emprendejovendelaperla,"['arrancamos', 'con', 'la', 'presencia', 'de', 'cerca', 'de', '3', 'mil', 'visitantes', 'muchas', 'gracias', 'por', 'darse', 'una', 'vuelta', 'y', 'conocer', 'a', 'los', 'más', 'de', '200', 'emprendedores', 'de', 'la', 'capital', 'y', 'el', 'estado', 'que', 'vinieron', 'a', 'ofertar', 'sus', 'productos', 'recuerden', 'que', 'estaremos', 'hasta', 'el', 'domingo', '24', 'habrá', 'muchos', 'eventos', 'conferencias', 'conciertos', 'y', 'emprendimiento', 'sigamos', 'consumiendo', 'local', 'emprendejovendelaperla']"
467,hacer uso de la bici es la mejor alternativa para reducir la contaminación y beneficiar nuestra salud en este y todos los días nos ponemos en movimiento en bici únete a nuestro movimiento y luchemos por un medio ambiente más sano díamundialsinauto,"['hacer', 'uso', 'de', 'la', 'bici', 'es', 'la', 'mejor', 'alternativa', 'para', 'reducir', 'la', 'contaminación', 'y', 'beneficiar', 'nuestra', 'salud', 'en', 'este', 'y', 'todos', 'los', 'días', 'nos', 'ponemos', 'en', 'movimiento', 'en', 'bici', 'únete', 'a', 'nuestro', 'movimiento', 'y', 'luchemos', 'por', 'un', 'medio', 'ambiente', 'más', 'sano', 'díamundialsinauto']"
470,siguen eventos y conferencias chidas el día de mañana chequen a las y los conferencistas que nos acompañan en con temas interesantes para emprendedores y público en general emprendejovendelaperla,"['siguen', 'eventos', 'y', 'conferencias', 'chidas', 'el', 'día', 'de', 'mañana', 'chequen', 'a', 'las', 'y', 'los', 'conferencistas', 'que', 'nos', 'acompañan', 'en', 'con', 'temas', 'interesantes', 'para', 'emprendedores', 'y', 'público', 'en', 'general', 'emprendejovendelaperla']"
473,los esperamos este viernes 22 sábado 23 y domingo 24 en en plaza liberación expoemprendedelaperla,"['los', 'esperamos', 'este', 'viernes', '22', 'sábado', '23', 'y', 'domingo', '24', 'en', 'en', 'plaza', 'liberación', 'expoemprendedelaperla']"
479,el alcalde pablo lemus informó en se analizan propuestas para instalar en el municipio una alarma sísmica el tiempo estimado que podría dar de anticipación sería entre 40 y 60 segundos según la zona en la que se registre el sismohasta el momento se ha instalado una alarma en el centro comercial plaza andares donde esperan analizar su funcionamiento y evaluar la pertinencia de colocar otras en diferentes partes del municipio la primera opción sería el centro histórico a su vez el director general de skyalert álvaro velasco explicó que primero se espera instalar un receptor digital en la zona metropolitana para que los ciudadanos puedan descargar la aplicación agregó que no se busca un alertamiento en bocinas como pasa en otras ciudadesvisita la nota en notijalmx3ruoxe5 guadalajara,"['el', 'alcalde', 'pablo', 'lemus', 'informó', 'en', 'se', 'analizan', 'propuestas', 'para', 'instalar', 'en', 'el', 'municipio', 'una', 'alarma', 'sísmica', 'el', 'tiempo', 'estimado', 'que', 'podría', 'dar', 'de', 'anticipación', 'sería', 'entre', '40', 'y', '60', 'segundos', 'según', 'la', 'zona', 'en', 'la', 'que', 'se', 'registre', 'el', 'sismohasta', 'el', 'momento', 'se', 'ha', 'instalado', 'una', 'alarma', 'en', 'el', 'centro', 'comercial', 'plaza', 'andares', 'donde', 'esperan', 'analizar', 'su', 'funcionamiento', 'y', 'evaluar', 'la', 'pertinencia', 'de', 'colocar', 'otras', 'en', 'diferentes', 'partes', 'del', 'municipio', 'la', 'primera', 'opción', 'sería', 'el', 'centro', 'histórico', 'a', 'su', 'vez', 'el', 'director', 'general', 'de', 'skyalert', 'álvaro', 'velasco', 'explicó', 'que', 'primero', 'se', 'espera', 'instalar', 'un', 'receptor', 'digital', 'en', 'la', 'zona', 'metropolitana', 'para', 'que', 'los', 'ciudadanos', 'puedan', 'descargar', 'la', 'aplicación', 'agregó', 'que', 'no', 'se', 'busca', 'un', 'alertamiento', 'en', 'bocinas', 'como', 'pasa', 'en', 'otras', 'ciudadesvisita', 'la', 'nota', 'en', 'notijalmx3ruoxe5', 'guadalajara']"
482,si bien han sido grandes los avances en cuanto a la política estatal anticorrupción es necesario crear más etapas que permitan reforzarla por eso les comparto que ayer acudí a la firma de compromisos en esta materia en la cual participamos las autoridades estatales y municipales y la sea jalisco con el fin de prevenir detectar y sancionar hechos que estén fuera del marco de la leytengan por seguro que desde san martín de hidalgo seguiremos trabajando como hasta hoy para erradicar estos actos avanzandoyconsolidando,"['si', 'bien', 'han', 'sido', 'grandes', 'los', 'avances', 'en', 'cuanto', 'a', 'la', 'política', 'estatal', 'anticorrupción', 'es', 'necesario', 'crear', 'más', 'etapas', 'que', 'permitan', 'reforzarla', 'por', 'eso', 'les', 'comparto', 'que', 'ayer', 'acudí', 'a', 'la', 'firma', 'de', 'compromisos', 'en', 'esta', 'materia', 'en', 'la', 'cual', 'participamos', 'las', 'autoridades', 'estatales', 'y', 'municipales', 'y', 'la', 'sea', 'jalisco', 'con', 'el', 'fin', 'de', 'prevenir', 'detectar', 'y', 'sancionar', 'hechos', 'que', 'estén', 'fuera', 'del', 'marco', 'de', 'la', 'leytengan', 'por', 'seguro', 'que', 'desde', 'san', 'martín', 'de', 'hidalgo', 'seguiremos', 'trabajando', 'como', 'hasta', 'hoy', 'para', 'erradicar', 'estos', 'actos', 'avanzandoyconsolidando']"
488,fui a la presentación del libro el puente de las damas de enrique ibarra secretario general del gobierno de jaliscoen este libro que forma parte de la serie editorial biblioteca tapatía su escritor se dedicó a resaltar desde la memoria y el simbolismo esta importante construcción que representa el desarrollo urbano de guadalajara desde el siglo xviiimuchas felicidades secretario puentedelasdamas,"['fui', 'a', 'la', 'presentación', 'del', 'libro', 'el', 'puente', 'de', 'las', 'damas', 'de', 'enrique', 'ibarra', 'secretario', 'general', 'del', 'gobierno', 'de', 'jaliscoen', 'este', 'libro', 'que', 'forma', 'parte', 'de', 'la', 'serie', 'editorial', 'biblioteca', 'tapatía', 'su', 'escritor', 'se', 'dedicó', 'a', 'resaltar', 'desde', 'la', 'memoria', 'y', 'el', 'simbolismo', 'esta', 'importante', 'construcción', 'que', 'representa', 'el', 'desarrollo', 'urbano', 'de', 'guadalajara', 'desde', 'el', 'siglo', 'xviiimuchas', 'felicidades', 'secretario', 'puentedelasdamas']"
