texto,emocion
pero que terco eres deberas que como deceas ser gobernador de jalisco que es lo que te impulsa el poder o la corrupcion    ,anger
Ya borraste las bardas pintadas pocos    ,neutral
"Ya retírate, descansa.    ",neutral
hizo servicio social cuando estuvo en la cárcel ?    ,neutral
"Jajajajajaajajaj toda mi vida viviendo de mi comunidad , más bien , no?    ",amusement
presentan encuesta de para Jalisco al corte de esta semana. Advierte que si sería hoy la  ,neutral
498,neutral
"jajaja se aplica maquillaje, edición. y cuando va a eventos con muchos reflectores se lleva sueteres con cuello de tortuga. 
jajajaj    ",amusement
Cual comunidad perdón yo no e visto que vaya a donar medicamentos o tratamientos de cáncer a la gente ya que su praton quito esa ayuda    ,neutral
"Mujer, vida, libertad: este fue el grito que envió a la cárcel a Narges Mohammadi, activista iraní que ha sido galardonada hoy con el Premio Nobel de la Paz.

Ella y muchas otras mujeres, víctimas de una sistemática violencia y de la indiferencia de su gobierno ante sus clamores,…   6",neutral
La verdad se pasan que mal   1,disgust
    http://,neutral
"puras fallas, ya ni porque su carnal es millonario, chales mendigo coraje por eso estamos como estamos   1",neutral
Ve nomás   1,neutral
"ratero ratero!!! no quieren a morena en Jalisco y con este tipo de alcalde , menos a ver , 1",neutral
Mira quién te quitará Jalisco    ,neutral
Todos Solo CEO en Camiseta 108 votos,neutral
"viejo guanjo , jalisco no quiere sus cochinadas    ",neutral
    leer descripción de la imagen,neutral
Y pa cuando sacamos las dagas que ha hecho    ,neutral
"Wey a quien ponga MC vamos a votar por el, no por ti, entiende menso    ",approval
Ya borraste las bardas que mandaste pintar y que aparte lo niegas    ,disapproval
     ,neutral
"Bien aprendido del que esta en mando,el chiste es emcapricharse y ser vividor y en unos 20 años talves ganes    ",amusement
"Irónico y sarcástico
""toda mi vida sirviendo a mi comunidad""

El chiste se cuenta solo.    ",joy
     ,neutral
Autlán y el Distrito 18 de Jalisco estamos con Usted Doc! Cero impunidad contra los naranjas corruptos que embargaron y robaron el dinero de los jaliscienses!   1,anger
214 que reconoce el trabajo conjunto de empresas y organizaciones con acciones integrales más sostenibles.  ,neutral
"Llevo toda mi vida sirviendo a mi comunidad, y hoy, en el Distrito 4 de Zapopan, recordé mis primeras visitas de trabajo social hace casi dos décadas, de la mano de jóvenes que hoy son líderes.  Todavía hay muchas carencias, pero vamos a luchar, con la conciencia y el corazón,…   17",realization
Les falto el    ,disapproval
     ,neutral
Tus post jajaja pobre pendejo de ti    ,amusement
"488 , and all our fans to share photos of this amazing creature!  ",excitement
Mentiroso    ,amusement
Para los jaliscienses será un gusto hacerte perder de nuevo.    ,joy
ya necesitamos a el dr. de gobernador en jalisco y asi va ser apoyo para el dr. lomeli    ,approval
¿Vas a decir algo de lo que pasó en el edificio Lobby 33? ahí mataron a un joven y es propiedad de    ,curiosity
181,neutral
El proximo gobernador de jalisco apoyo total para usted dr. lomeli  ,caring
Jalisco necesita un cambio y llegara con el dr. lomeli apoyo total para el    ,approval
Jalisco esta con el dr. vamos por la transformacion en Jalisco    ,neutral
Vamos por la transformacion de jalisco de la mano de el dr. lomeli    ,optimism
"Esa cosa no es un vocero, es su lame huevos y aparte es putito jajajaaja    ",amusement
Viejo corrupto sabes que no vas a ganar y aun así sigues    ,disappointment
"Tal vez usted sea el mejor candidato para Jalisco solo que chava desprestigio su partido con tantas cosas que se le conocen, una lastima para morena tenga aspirantes con pensiones de oro como es el candidato a gobernador Salvador!!!!    ",neutral
"Las mujeres de Jalisco merecen vivir libres, plenas y con dignidad. Hagamos de este sueño una realidad.   44",approval
Seguro son de morena!    ,approval
"Dr. Desgraciadamente usted es el mejor candidato para Jalisco pero al parecer no para los que integran morena en Jalisco, menos para los intereses de Peña    ",disapproval
Cuéntanos de esto mi perro lugar de tu amo #LOCAL,curiosity
"La va a ganar, pero la que se ganó en 2012, en 2015, en 2018 y 2021    ",approval
Por fin va ganando en una encuesta ese bueno para robar. Tengo desde el 2012 viéndolo perder cada 3 años.    ,realization
"Si lanzan a ese pendejo es victoria segura para los pelones de Alfaro.i
De ese we a Lemus, la banda va a elegir a Lemus. Una kgada de candidato lo que presenta Morena    ",annoyance
no para recorre dónde plática con los militantes y simpatizantes de  ,neutral
Propiedad de    ,neutral
Lo único que usted va a coordinar son las transas en sus empresas… pero gracias por su preocupación Doc!    ,gratitude
P1nch3 cínico!!    ,neutral
"Dr, ya dejese de mamadas, en Jalisco nadie lo quiere, ya dejé la oportunidad a alguien más .    ",disappointment
"Efectivamente, llevas casi 20 años comprometidisimo con los intereses personales y en pie de lucha por no soltar el hueso.
Ahora más que nunca sabemos  de tus aspiraciones.

Justamente, seremos el motor para que la desesperanza de una nula ""transformación"" NO  destruya    ",approval
Que raro que ahora no diga nada sobre lo sucedido en el edificio de su padrino 1,surprise
Jalisco no aguanta más! No cabe duda que el pueblo de Jalisco encontrará en Usted estimado Doc el liderazgo apto para construir la  ,neutral
Y aún así  de torpe lo quieren de candidato otra vez!!! Fuera Lomelí de Morena!!!    ,love
     ,neutral
"Como olvidar cuando predijo el triunfo de MC en Guadalajara y en la mayoría de los municipios de Jalisco. 

Y eso que el bato era candidato a la presidencia de Guadalajara por Morena. 7",neutral
547,neutral
Y su vocero tendrá algo que decir? 2,neutral
"Oiga ¿Ya va a decir algo sobre lo que pasó en uno de sus tantos edificios? ¿Esos asesinos son amigos suyos? Digo es bien sabido que usted tiene nexos con el narco, hasta fue detenido en EUA por ello.

¿Es usted amigo de los tipos que asesinaron a un chavo a… 27",curiosity
Que casualidad    ,surprise
Continúa recorriendo Jalisco en aras de ser el abanderado de  ,neutral
Así es Doc. Gastando suela con el pueblo.    ,neutral
"Ve a revisar tu edificio, tienes un desmadre con tus amigos los narcos.   #LOCAL",neutral
"En su objetivo de ser coordinador de la defensa de la transformación en Jalisco, no deja de recorrer el estado. #4T",neutral
"¡Todo el Apoyo al para liderar y representar a Morena en Jalisco! Su experiencia, compromiso y perseverancia son clave para un mejor futuro.  ",optimism
"¿Cuáles encuestas? Ah sí, las cuchareadas por su propio partido, se debería modificar la ley para que un candidato solo pueda participar dos veces máximo en puestos de elección popular, este señor corrupto no le ha quedado claro que nadie lo quiere.    ",curiosity
"Así es como se hace con la gente directamente, gracias siempre por la cercanía Dr lomeli    ",gratitude
"El día de hoy tengo el honor de compartir un diálogo con militantes y simpatizantes de Morena en Teuchitlán. En esta reunión, les hablo sobre mi compromiso con la Cuarta Transformación y por qué motivo aspiro a coordinar los Comités de Defensa de la en Jalisco.

Llevo casi 20… 16",pride
es el próximo gobernador de Jalisco …. FUERA MC YAAA   2,neutral
"| Este Miércoles, el visitó 9",neutral
Eres una mujer con garras de la debensa adelante charrita    ,neutral
"Doña, y del asesinato en Lobby 33 que le pertenece al no va a hablar?  ",neutral
"Oye mamarifles, mataron a un we en el congal de tu matador el a qué horas vas a culpar a Movimiento Ciudadano? 3",neutral
"Ojo aquí

Fue en el edificio  que pertenecena Al que #LOCAL",neutral
"235,7 mil   http://",neutral
"¿Que opinas del hombre asesinado en un edificio de ?

¿Será que 6",curiosity
¿Vas a decir algo del asesinato de un hombre en el edificio de ? ¿O ahí te vas a quedar callado?  ,curiosity
Y tu matador de cuando responderá ?  ,neutral
En respuesta a @Libro_negro_  ,neutral
6.337   https://,neutral
En respuesta a @Libro_negro_  ,neutral
En respuesta a @Libro_negro_  ,neutral
En el edificio de El candidato de Morena a la gubernatura de Jalisco!? 4,confusion
Hola y demás secuases de la 4t quiero ver sus maromas  ,neutral
100 Stream Hope Bloom  ,neutral
Upsss otra Involucrada en laVenta a Sobreprecio. Entre Hiram Torres y ella se pasan la Bolita  ,neutral
     ,neutral
"Con perseverancia, compromiso y mucho trabajo, los sueños se cumplen.   5",approval
Achaspm los de MC!    ,neutral
"Y ni todo el dinero que tienes te va alcanzar para comprar la honestidad, eso es algo que no conoces y que jamás conocerás.    ",optimism
"Tu presidente AMLO ya dijo que los militares no tuvieron la culpa, seguramente los estudiantes se dispararon solos    ",neutral
"Típico de morena, tirar la piedra y esconder la mano.    ",neutral
Porque no demandas a ese wey también tiene cola que le pisen… o acaso lo haces porque ya viene la temporada de elecciones 1,neutral
"neta q lentos son, todo el poniente de la ciudad literalmente abandonado, la Avenida Malecón y Patria d El Zalate, lleno d pandillas, y uds? No usan eso. Necesitan asesoría    ",neutral
"Acerquense a Dios,
y veran como la paz y prosperidad llegaran a sus vidas porque todo lo de Dios es siempre bueno. . Saul  ",optimism
A partir de cuando? llevan 3 administraciones y mira que en una compitio y no pudo  ,neutral
"Ojalá sea Clara, Lomeli pierde todo no tiene carisma, es aburrido, está desfasado!    ",disappointment
Nombramiento del Chayote de Oro    ,neutral
Usted debería quitar esos mensajes en las bardas y esas lonas en apoyo a su persona para que no quede duda de que usted no los mando poner    ,neutral
  Stream Hope Bloom  ,neutral
En serio???    ,surprise
"Vete a un estado del sur, ahí si quieren a , no importa si les ponen de candidato un corrupto, ratero, con nexos con el narcotráfico, van a votar por él  ",neutral
Ay no mame    ,neutral
Tu culo    ,anger
Lo aplicaste vendiendo medicamentos a sobreprecio. Tu honestidad es innegable    ,approval
Vamos Clara Cardenas!    ,neutral
Estamos contigo Clarita.    ,caring
El burro hablando de orejas    ,neutral
Bardas las que puso Lemus en para su informe de campaña y que casualmente borraron y solo dejaron un logo    ,neutral
"Conforme avanza el proceso electoral rumbo al 2024, en Jalisco, Morena aumenta preferencias para derrotar a MC; igualmente, se coloca como el puntero para ser el candidato de acuerdo a varias encuestas. 5",neutral
"Pero aún les falta que la CDMX perdone a la judía católica cristiana por lo de la línea 12, la falta de mantenimiento del metro y lo del COVID.
De Jalisco y NL nunca votarán por y más cuando en Jalisco está nominado el delincuente de  ",neutral
"Claro que no los conoces doctor penicilina, los pagas y lo hacen sin jamás conocerse    ",neutral
Manipulación de información para no caer en consecuencias pre electorales y post electorales.    ,neutral
Ten la seguridad.    ,neutral
En Jalisco no quieren a Lomeli . siempre que se lanza pierde.  ,neutral
5.348,neutral
     ,neutral
"Usted ni honesto ni integro, en pocas palabras una baratija    ",disapproval
No es muy honesto vender omeprazol a sobre precio    ,disapproval
De veras???????!!!!!!!!!    ,surprise
Que propones sobre la verificación recaudatoria que agobia y afecta la economía de los jaliscienses?  ,curiosity
"wow!!! sitando al capital ?
Ya sabemos a quien admiras y para q haces como q trabajas... 

xD    ",excitement
Ya deberían cortarle el internet...    ,neutral
Generación espontánea de publicidad electoral.    ,neutral
"Unas de las tareas de un regidor es proponer solución a los problemas del municipio, así que de cierta forma si le toca, a menos proponerlo.    ",neutral
Cómo les gusta hacerse pendejos jajajajajajajajajjajajajajajjaja    ,amusement
"Tus bardas publicitarias me hacen odiarte mas, ahi dejalas ! esta funcionando tu estrategia    ",anger
Mismas justificaciones de los morenos. Pensé que eras diferente    ,realization
JJAJAJAJA NETA NO SABES?  QUE BARBARO    ,curiosity
"No te casas de leer tantos.tantos pero tantos, pero tantos tweet que te responden    ",neutral
     ,neutral
No mames Lomelí jajajaja jajajaja    ,amusement
    leer descripción de la imagen,neutral
Ojalá vuelva a perder    ,disappointment
  During live coverage of hears from,neutral
Ya se lo bueno que va a perder    ,sadness
Típico de los de morena hacerse wey    ,neutral
Jajajajajaja    ,amusement
Eso es todo Juncal¡    ,neutral
38,neutral
"Si usted es el candidato de morena es otra perdida segura, ya todos lo conocen y no creo que nadie vote por su partido    ",disapproval
Al estilo de claudia y todos los de morena jajaja    ,amusement
"Carlitos, si dices que ama al pueblo, dime tu porque se empeña a diario en joderlo.

Porque insisten en insultar nuestra inteligencia. ¿Porque?    ",neutral
Va a ganar Doc los jaliscienses ya es amis listos para correr al mc    ,neutral
Che rata de cuello blanco ! Quien gastaria dinero a favor y anónimamente por usted ? No tiene jefa    ,neutral
"Jajajaja, no he visto ninguna!! Pero si, si tú dices ""te creo"" jajaja!! Corrupto de    ",amusement
"Y si el transformador de cuarta que va por otro ridículo electoral y político no fué ni sus compañeros de secta tampoco, (según él) porque ""se deslinda"" e invita a sus secuaces a ""respetar los tiempos electoreros""  ???
JUSTIFICACION NO PEDIDA...........    ",neutral
Yo jamás lo haría.    ,neutral
A quien le quedo demasiado grande el cargo    ,neutral
"Hoy conmemoramos el 2 de octubre, un día que no se olvida, y en 2011, se fundó como asociación civil. Un paso crucial en nuestro camino hacia la democracia y la justicia de Mexico y de nuestro estado . 

En 2018, logramos un cambio. Hoy, tenemos un Presidente que… 5",joy
Que dice el papá de Checo que el no tiene una foto como esta para presumir a dónde apunta el dedito:  ,neutral
"Está fácil... Vamos enviando una propuesta al Dr. Lomelí:
Si en verdad no tiene idea quien las puso, demuestre que no las quiere Y BÓRRELAS USTED MISMO!!  ",neutral
Corrupto.    ,anger
Los “alliens” están entre nosotros y apoyan al    ,neutral
"Mira, justo el mismo discurso de Sheinbaum; qué bueno es el pueblo que así sin más va a pintar bardas para apoyarlos...    ",admiration
161,neutral
"Y todas iguales, y con  tipografía, diseño de acuerdo a su campaña    ",neutral
Jajajaja jajaja    ,amusement
Apóyenos mejor a que procedan las denuncias por cobros indebidos por parte del secretario de Pablo Lemus Ricardo flores López y el@director de atención ciudadana Esteban García Iñiguez    ,neutral
"Mejor no opinar, como que no sabes quién te está promocionando, empezamos mal...    ",disappointment
     ,neutral
Pues entonces eres una persona barata. ¿Comprar candidaturas es honesto?    ,neutral
jajajaja vete alv Supporters 88  ,amusement
"Movimiento Ciudadano es el hermano de Morena, no voten por esos políticos  que se acoplan a las órdenes del viejito    ",disapproval
Mucha gente me dijo que tú pagaste por esas bardas.    ,neutral
"Eres de morena?… ahh ya, seguro es alguna editorial, algún proveedor tuyo, alguien que lo hace “de su bolsa” verdad?    ",neutral
"El inversor y empresario Warren Buffett acuñó  la frase: ""La honestidad es un regalo costoso,  no lo esperes de personas baratas"". Y sin duda,  en la vida, la integridad es la base de una  sociedad fuerte y próspera. ¡Tengan un buen  arranque de semana!   3",approval
Pir isti midii minifiisti...    ,neutral
Mira tu .. igual que Juanita Brugada en el DF. Tienen amigos muy pudientes para gastar millones a lo p3ndej0. ¿Y las enseñanzas del amo?    ,neutral
Insisto la política es necesaria los políticos son una mierda    ,annoyance
JAJAJAJAJAJAJAJAJAJAJAJAJAJAJAJAJAJAJAJAJA    ,amusement
     ,neutral
Jajajaja    ,amusement
"Hijos de su pu74 madre, todos son iguales....
Jajaja jajaja jajaja jajaja    ",amusement
"Oi nomás, hazte pen...diente    ",neutral
"Si en Jalisco se aplica la encuesta como criterio para definir al candidato a la gubernatura, sería inevitablemente el elegido. Supera con creces a los/las demás  ",neutral
99 stands out.  ,neutral
jaja.    ,amusement
"Pa que te haces wey, si eres tú, bien sabes que te van a dar la candidatura, pues ya la pagaste, ya ofreciste dinero a la campaña de Claudia.    ",neutral
Quién haya sido no vas a Ganar !!!    ,disapproval
Es gente espontanea    ,neutral
Ya haciendo campaña doctor transas    ,neutral
No mm    ,neutral
Tu fuiste el que metió en apuros al IPEJAL en aspecto de medicinas tu y tus transas    ,fear
"Morena dio a conocer los nombres de los cuatro nominados por el Consejo Estatal del partido en Jalisco. De ellos, sólo se encuentra posicionado dentro del Top 10 de nuestro Power Ranking de la entidad. 4",neutral
"En lugar de ""deslindarse"", bórrelas con cargo a sí bolsillo    ",neutral
     ,neutral
Tus amigos los narcos las pintaron.    ,neutral
"Carlos 

Fui yo.

Cuando ganes te acuerdas de mi....    ",neutral
Ya we no te lances OTRA VEZ de candidato por favor!    ,neutral
esta bien raro no? jajajajaj patan lacra    ,amusement
     ,neutral
"Hazte menso jajajaja, bien que le pagas 500 por cada barda pintada.    ",amusement
Ya quitenle al tío el celular.    ,neutral
    leer descripción de la imagen,neutral
Jajajaja ridiculo corrupto vas a perder con todo y tus lonas    ,amusement
Chtpm pinché lacra de    ,neutral
"JAJAJAJAJAJAJA, ahora resulta que por puro amor a tu persona la gente gasta en esas mamadas. Políticos siendo políticos.    ",amusement
"Jajajajaja
No mames pinché corrupto    ",amusement
"Si te beneficia o te perjudica,  ya debiste haberlas borrado . Todas !    ",realization
Chema Martínez ll    ,neutral
"Hay muchas bardas pintadas, que bueno que usted si se apegue a la ley.    ",admiration
"Siendo una blanca Paloma te entendemos , lo que no entendemos que si en un momento fuiste  proveedor  de precursores químicos para un cartel ,tu amigo el humanista   te permita aspirar a ser  gobernador    ",neutral
Otra del PRI?    ,curiosity
Putæ rata    ,neutral
"Jajajajajajaja ¡Hipócrita!

Si toda tu vida ha sido navegando en la corrupción y la ilegalidad.   2",amusement
"Hazte a un lado. El Partido no crece por ti. Tú eres la causa que Movimiento Gobierne casi todo Jalisco. Acéptalo, el pueblo de Jalisco no te va a elegir. 

Deja que otros tengan la oportunidad. 

O ese es el pacto que hiciste con Alfaro?    ",curiosity
Jajaja típico de los morenacos.    ,amusement
Dejen de pensar que los ciudadanos somos ignorantes. Nadie se que cree eso que escribes. Son ustedes mismos haciendo proselitismo. Farsante.    ,anger
"Otra vez usted? No se cansa de fracasar? Esta bien que se dice que “solo fracasa el que no lo intenta”, pero Usted no es viable para ningún proyecto electoral, deje que otros compitan    ",caring
Un mal chiste este tipo    ,annoyance
Jajajaja    ,amusement
"Mentiroso, corrupto y descarado. Jaja, no vas a ganar, Carlitos, mejor utiliza tus recursos para tu empresa o familia.    ",amusement
Seguro son tus millones de fans    ,neutral
Jajajajajajq pinche cínico !    ,amusement
Jajjajajajajajajaja como se hacen pndjos    ,amusement
"A pesar de estar prohibidas por Morena, en la CDMX y en Jalisco han aparecido bardas que promocionan a alguno de los aspirantes. 

. y 1",neutral
Diversas? En toda la ciudad hay bardas con tu nombre y a un lado las siglas CJNG    ,confusion
     ,neutral
     ,neutral
"Ridículo. Siempre te haz caracterizado por los negocios sucios, y la política no es la excepción en tu caso. Los contratos para venta de medicamentos a sobreprecio, y el gasto desmedido en las campañas, van de la mano.
solo que... aún no es tiempo de campaña    ",annoyance
"Bueno, tu si masticas agua,  verdad ?    ",neutral
"No mams,quieres que sea presidente para que le aumente sueldo a los policías,que pendej0 estás    ",neutral
Como si tuviera apoyo incondicional y gratuito jajajaja   11,amusement
"Jajaja claro Dr. Apoyo a su persona jajajajajajaja  si es toda una tradición del Mexicano gastar dinero por amor a un politico o ratero, jajajajaja ni los lambiscones le meten dinero a eso, ha que las nuevas maromas ante de las elecciones. Jajajajajaja    ",amusement
UNIDAD    ,neutral
Dile a Frainge    ,neutral
     ,neutral
"AMLO mando toda su artillería pesada CO a jalisco para desprestigiar al gobierno , así ataca MORENA, pero ya ven en guerrero ni aunque ganaron a mejorado nada y esta peor hay selos dejonpara que lo analicen , infórmense, no sedejen guiar por los voceros de morena ,no caigan .    ",neutral
"Casualmente a todos los políticos, de un tiempo a la fecha, les aparecen bardas pintadas con sus nombres, así, bien raro!!   8",realization
"Políticos, siendo políticos    ",neutral
Reclama al de Zapopan    ,neutral
Desconozco dice el hdspm! igual que la otra pendeja  ,disapproval
     ,neutral
De los impuestos no creo... Esos se irían con el candidato de MC o van en alianza?    ,curiosity
Arriba pusieron que a él no le toca eso igual si lo preguntas al indicado se puede hacer algo  ,neutral
"Los políticos
Y sus mentiras

Siempre ocultando la verdad

No valen corneta    ",realization
Creo el no es de ZPN ♔  ,disapproval
"Aplicando el Chemazo, desconociendo el apoyo, osea que las personas lo hace de a gratis, sin recibir sueldo? jajaja no lo se rick!    ",amusement
Que bueno que se vuelve a postular… para que no gane MORENA en Jalisco… guarde este tweet…    ,neutral
Mi perro me miente mejor y no sabe ni hablar   28,realization
No MMS....    ,neutral
"A él no le toca, es regidor en Guadalajara.    ",neutral
Mintiendo hasta en eso.    ,neutral
"Dice, desconozco los que las pintaron, pero se los agradezco mucho, ánimo!...    ",gratitude
Entonces usted por su propia mano borrelos   8,neutral
"No junta ni 100 likes en sus post y resulta que tiene quien gaste su dinero en la basura que usted representa, no diga mmds.  ",neutral
     ,neutral
#NOMBRE?,neutral
oye,neutral
Que no se cansa de chingar al pueblo,anger
Olvidó agregar que en 2015 fue diputado federal Gracias a MC,gratitude
 ,neutral
"Jajajajajajajaja “de sol a sol” , si después de la mañanera que (según él) es trabajo ya no hace nada el hue von.",amusement
Estamos listos para ver la madriza que te va a poner,excitement
Y que tan atrás voltea??,curiosity
"Jajaja jajaja jajaja hdspm....
Q se los crea su madre!!!",amusement
 ,neutral
Fuera Lomelí.,neutral
Jajaja no mamssss,amusement
 ,neutral
Donde habré escuchado eso?,confusion
20 años y nadie en el video puede decir ningún logro que hayas hecho?,curiosity
Hahaha no mas no Venda medicinas a sobre precio y arre !!!,amusement
"Jajajajajaja Jajajajajaja
Jajajajajaja Jajajajajaja Jajajajajaja Jajajajajaja Jajajajajaja Jajajajajaja Jajajajajaja Jajajajajaja Jajajajajaja Jajajajajaja Jajajajajaja Jajajajajaja Jajajajajaja Jajajajajaja
Ladrón hipócrita",amusement
"A cuánto el PARACETAMOL??
Vender medicamentos a sobreprecio, se considera honesto?",curiosity
Que dice el que abuso la confianza para beneficio de su farmacéutica?,curiosity
"Jajajajaja, oilooooooo!",amusement
Para el doctor la honestidad es su motor!,neutral
 ,neutral
En,neutral
Con todo,neutral
"Pero ya tuviste tú oportunidad,  deja que alguien más sea candidato. Además no se olvida que cuando fue la pandemia te viste mal , agandayando los medicamentos .",realization
Lo que les guste a ti y al otro pendejo nos vale pura madre,anger
Totalmente de acuerdo Dr Carlos lomeli Bolaños y cuente con nuestro apoyo dtto 14.,approval
"20 años y sin ganar nada pero como no tengo nada mejor que hacer ahí le seguimos hasta q ""pueda servir al pueblo bueno...""",disappointment
Eso no dice en sus órdenes de aprehensión y arreglos al declararlo culpable,neutral
20 años perdiendo,realization
Solo le ponen más fácil el camino a MC ... Pura llamarada de petate,neutral
"Yo conozco al doctor Carlos Lomelí de añales!! Es y será el eterno perdedor de la política, ademas, como regidor de Guadalajara es el que más faltas tiene… ósea que él huevon ni a trabajar va",disappointment
Agradecemos infinitamente que la 4T. Desaparezca de todo el país.,admiration
"Ni madres, porros , corruptos, autócratas de porquería.",anger
Llevas 20 años robándole al erario de México con tus medicinas a sobreprecio.,annoyance
Quieres la gobernatura para llenarte los bolsillos de dinero,desire
Jajaja.,amusement
Abeses no es nesesario conoser tanto tiempo si su obras se denuestran vien eso abla d una persona,neutral
Cuenta con nuestro apoyo Dr Carlos lomeli Bolaños,neutral
Jajaja jajaja jajajaja jajajaja jajajaja jajajaja jajajaja jajajaja jajajaja jajajaja,amusement
20 años y no has hecho ni madre,neutral
 ,neutral
Robando por todo México,approval
"Cómo buenos Jaliscienses estimado Doctor, con todo y por el bien del pueblo de Jalisco",admiration
Con todo doctor!,neutral
Dices…,neutral
ruco ratero ya sientese,neutral
Onde aparece que es un regidor huevón?,curiosity
"Urge la 4t en Jalisco, urge sacar a cuartazos a los malos gobiernos
Confiamos en UD",approval
Jajajjajajajaajjajajjjajaajaajjaa HONESTIDAD… jajajajjajajjaaajajaajajaja,amusement
"Ya lo queremos ver como senador o diputado federal.

Creemos que podrá hacer una buena labor.",admiration
"Con los hechos lo ha demostrado Doctor. Vamos a Transformar Jalisco, así puede!!!",neutral
